,comments,TextBlob_polarity,TextBlob_subjectivity,TextBlob_label,BERT_label,BERT_score
1093,mark zuckerberg is very intelligent but very emotionally and socially immature,0.344444444,0.637222222,positive,positive,0.809518635
1094,sorry zuck but vr brick on face is not that nice,0.05,1,neutral,negative,0.900542676
1095,wow his hair transplant looks ridiculous,-0.116666667,1,negative,negative,0.90377003
1096,is this vid an iphone commercial,0,0,neutral,neutral,0.649545729
1097,nobody forced you to sign up whats the point of putting  your blame onto smb else just weak human nature,-0.225,0.308333333,negative,negative,0.966762722
1098,i never had a facebook account because im not a 13 year old girl or a gay homosexual,0.258333333,0.391666667,positive,negative,0.880223393
1099,maddie madelyn mad pettis and chris ninapaytan,-0.625,1,negative,positive,0.736186147
1100,its only me,0,1,neutral,neutral,0.603845656
1101,arrr you sorry for that yer i bet you are,-0.5,1,negative,neutral,0.541225433
1102,i think it rides on poop if grr,-0.7,0.8,negative,neutral,0.5879969
1103,no supplied captions the autogenerated ones suck and you stumble your words reading a script nice not,0.275,0.55,positive,negative,0.921233535
1104,mans never hot,-0.125,0.85,negative,neutral,0.677010477
1105,just a load of arsoles,0,0,neutral,negative,0.839399219
1106,jorge cameras lopez1,0,0,neutral,neutral,0.532920837
1107,google  poco like,0,0,neutral,neutral,0.633510888
1108,his hair looks like it doesnt fit his head,0.4,0.4,positive,negative,0.883923948
1109,f meat head  fo,0,0,neutral,neutral,0.676305294
1110,ahole of note,0,0,neutral,neutral,0.540929973
1111,i c 33,0,0,neutral,neutral,0.529567778
1112,get off the internet  stop babysitting your children with google  put the phone in the bin ,0,0,neutral,negative,0.918682158
1113,short term videos are annoying,-0.4,0.6,negative,negative,0.948829889
1114,haha see ya suckerburg,0.2,0.3,positive,neutral,0.584254563
1115,be private with utopia p2p,0,0.375,neutral,neutral,0.517636478
1116,video was good till the end when you i praise zuckerberg and insult tesla,0.7,0.6,positive,positive,0.710119307
1117,i very much think you had the descriptions mixed tesla is def trying to fix the world and zuckerberg is def a weirdo that doesnt give a fuck about and actively ruining it,-0.068333333,0.4275,negative,negative,0.954769552
1118,have you ever meta yatzi nazi,0,0,neutral,neutral,0.514703274
1119,terrible audio editing you left a lot of botched words,-0.5,0.5,negative,negative,0.973328888
1120,wait ppl use this garbage still why,0,0,neutral,negative,0.908921659
1121,did build a wood car grr,-0.7,0.8,negative,negative,0.710642874
1122,all men are created equal meaning everyone has different fates but one in common everyone has the knowledge of good and evil from kings to beggars what is your choice suckerberg what is your choice,-0.12,0.59,negative,positive,0.753924012
1123,pappy van winkle,0,0,neutral,neutral,0.563668132
1124,does anyone remember yahoo messenger,0,0,neutral,neutral,0.550159872
1125,vr headsets suck,0,0,neutral,negative,0.706281066
1126,idiots on youtube facebook collapse eminent,-0.8,0.8,negative,negative,0.862617373
1127,facebook quarterly earnings q2 2022 7 bil profits on 29 bil revenue  ,0,0,neutral,neutral,0.629480124
1128,me with some holdings in meta stock ,0,0,neutral,neutral,0.644641042
1129,i deleted mine after i realized that facebook was going to elect trump,0.8,0.9,positive,negative,0.851040721
1130,the political trash on that site is a plague,0,0.1,neutral,negative,0.930615306
1131,you wont find me on waste book,-0.2,0,negative,negative,0.772701919
1132,mixelplix superfreinds style,0,0,neutral,neutral,0.589639544
1133,no you didnt respect our privacy by the way you people should take a step back because you dont have no kind of respect for people freedom of opinin,-0.15,0.45,negative,negative,0.91990006
1134,this guy  is  brown eye of  putn not eye of  sayron as  ge like to  be  faceook is  a huge  russian  propaganda factory ,0.1,0.333333333,neutral,negative,0.86319685
1135,probly not grr hmm,0.35,0.8,positive,negative,0.717540741
1136,creepy ass interviewer at 220,-0.5,1,negative,negative,0.893553317
1137,sipho the guy,0,0,neutral,neutral,0.633402586
1138,1654 lizard man is a harmful antisemitic stereotype do better,0.5,0.5,positive,negative,0.910588086
1139,you sound like mark z kinda sus lol,0.6,0.55,positive,neutral,0.632457614
1140,zuckerberg laughing while discussing servious breaches,0,0,neutral,negative,0.807817578
1141,tik tok sounds gay,0.416666667,0.583333333,positive,neutral,0.549268067
1142,i liked my gt,0.6,0.8,positive,neutral,0.681988776
1143,anybody else annoyed by his voice,-0.4,0.8,negative,negative,0.887188911
1144,way too homophobic,0,0,neutral,negative,0.905910969
1145,your audio edits are jarring,0,0,neutral,negative,0.95718199
1146,012 a companys arrogance ,0,0,neutral,neutral,0.668446541
1147,315 digital stickiness,0,0,neutral,negative,0.789357662
1148,339 deepening its moat,0,0,neutral,neutral,0.571956575
1149,didnt do a good enough job protecting peoples data,0.35,0.55,positive,negative,0.910481036
1150,is a funny way of saying that they did everything they could to sell it,0.25,1,positive,positive,0.882071733
1151,i think facebook has also underestimated the negative reaction to overpersonalized content  its not just stories in the media that form bad press targeted ads too often is unnerving  the ads start becoming less about their content and more about how creepy they are,-0.119444444,0.580555556,negative,negative,0.929728568
1152,if you have a bad product but a near monopoly your business appears successful,0.05,0.672222222,neutral,negative,0.854155719
1153,its only when actual competition gains a foothold in the market that you realize just how fragile their spot at the top really was,0.14,0.46,neutral,negative,0.864290476
1154,when i was young i was taught that all ads were viruses and even to this day seeing an ad makes me more reluctant to buy whatever is being advertised out of sheer bloodyminded stubbornness and the pettiest spite imaginable,0.2,0.55,positive,negative,0.966271996
1155,the issue that fb has is that they are so untrusted that people will not purchase their new devices they made short term optimization decisions at the expense of long term trust and growth,0.028787879,0.384848485,neutral,negative,0.924664497
1156,no one is going to mourn fbs demise or look back with fond memories and nostalgia even as much as people who remember blockbuster and their awful late fees look back with nostalgia just to name one example,-0.22,0.36,negative,negative,0.772331357
1157,no one no one will do that for facebook,0,0,neutral,negative,0.800784409
1158,cant wait to see facebook fail miserably and go bankrupt,-0.75,0.65,negative,negative,0.926662028
1159,major problem with metaverse at the moment is that the ones youd expect to be the first to adapt to it  the gamers are extremely hostile against anything facebookmeta does,0.0625,0.611111111,neutral,negative,0.947622061
1160,i actual want to thank him he taught the current generation not to trust them and be cautious about what websites do with your data that knowledge will be passed down to future generations who because of his actions with facebook will be relegated to a museum exhibit,-0.038888889,0.228472222,negative,neutral,0.612325251
1161,when going through my phone apps i noticed facebook installer and facebook manager later called meta manager continously reinstalled themselves on my device despite me not using a single facebook app,-0.035714286,0.107142857,negative,neutral,0.645204663
1162,its these levels of creepy that make me adamant that i will never use anything they make,-0.2,0.85,negative,negative,0.837377369
1163,facebook died in my eyes the day i discovered i couldnt physically uninstall it from my phone its viewed by my kids and myself as forced spyware and is just one of those things that is just there its avoided like the plague because we know what they are my generation also has a fixed policy of never buying something from an ad youre forced to watch whether you might want it or not because we know its just a organised phishing scam  in some ways theyre helping to revive the high street were aware awake and like going out shopping in the real world again,0.015714286,0.261836735,neutral,negative,0.963380396
1164,from a totally unbiased perspective like my mom shes just frustrated that their is soooo much freakin ads and 90 of which are pyramid schemes fake products and scams made by fake accounts she often complains why there is ads on the videos she likes watching on dodo and cooking channels from my informed perspective not only is she right but the amount of ad tracking and fake accounts got me to finally deactivate my account when elon musk questioned twitter about the amount of bots on their platform all of the social media platforms were shook,-0.168095238,0.675238095,negative,negative,0.972850204
1165,i think that the constant lies and shady businesses have caught up to them it could have been something great but they have abused the trust of people and their privacy too much,0.1875,0.477083333,neutral,negative,0.959671199
1166,problem with facebook is that they forgot the reason facebook was created interaction with friends and meeting new people ,0.136363636,0.454545455,neutral,negative,0.955977738
1167,i created my fb profile back in 2010 at the age of 14 fb was a pretty good alternative to sms texting since it was technically free back then i had like 500 friends and every time id log in id only see friend related updates new profile pics posts youtube songs etc,0.185795455,0.531818182,neutral,positive,0.921107173
1168,the metaverse seems scary especially with all that personal data being provided for them,-0.166666667,0.766666667,negative,negative,0.909216225
1169,if you watch social network you definitely realize the type of person that mark is its a great movie and it explains how intellect most often is followed by greed and many other mistakes like mark likes to call it,0.284722222,0.448611111,positive,positive,0.983556271
1170,look im just going to come out and say it  google microsoft apple nintendo sony theyve all recognized the times when they needed to actually deliver a good product and just buckled down and produced it  they all made amazing things at some point and time be it a nice search engine streaming platform game hardware or software or something  but facebook  the more you use them the more you realize they are just in a speedy business model all the time  they always made their stuff addictive and always sold out their morals and cheapened the experience  everyone may not know the exact one and outs of it but you can tell theres something shady about it  you know theres bots fake accounts multiple accounts lame adds and content ridiculously algorithms horrible privacy and personal control etc  facebook is like the horrible landlord that you just cant wait to get away from first chance you get,-0.038888889,0.60248538,negative,negative,0.883453667
1171,any time zuck has to speak in public its solid gold hes literally richard from silicon valley sweating stammering and looking like hes cooking under the lights,0,0.083333333,neutral,negative,0.823082387
1172,the most disgusting thing is that they always say sorry but never really carefb is so untrustble,-0.275,0.675,negative,negative,0.971911371
1173,every time theres a break in major technological advancement the public narrative for the future seems to fall back to virtual reality theres a scene in the original jurassic park from the early 90s where one of the scientists has vr glasses and gloves on and is moving a virtual dna molecule around with his hands thats basically the metaverse its an idea thats been around since the 80s that never actually goes anywhere if you could go back to the 90s and explain netflix or iphones people would be completely blown away nobody ever imagined the tech we have now vr is something everyone has always imagined would be great but in actuality it really isnt,0.148863636,0.290151515,neutral,positive,0.756039381
1174,i never really got into facebook its weird at some point i felt like an outcast for not using it i tried it for like 6 months around when it became a thing and hated the experience we had a similar social media service in finland for years before facebook but suddenly everybody went there for reasons i never understood  but nowadays its no biggie at all we have so many ways to communicate that fb is kinda irrelevant,-0.183333333,0.545833333,negative,negative,0.962439895
1175,even with personal data these companies have a long way to go in terms of giving accurate tailored advertising depending on where you are i knew that fb was after more control more tracking and more data when they started to force users to download the actual app in order to use messenger whereas before you could choose to browse fb and use messenger from your browser even on your mobile devices instead of installing any app im against the you can only use my services via my app stance from any company because i like many people dont like being told what to do there are already enough apps we have to install whether we want it or not depending on where we live thanks to our banks governments and other unavoidable entities as it is when you take into account that not everyone has a high capacity storage phone or tablet when storage becomes an issue folks are going to prioritize installing apps they choose to install on that leftover space they have after installing the bank government and workrelated apps they are using in spite of themselves if a company doesnt give me a choice and wants to force me to install their damn app i might as well move on from using them im not using fb messenger much since they disabled the ability to use it via the web browser for android devices,0.17184492,0.420490196,neutral,negative,0.941537321
1176,i suspect meta would be having an easier go at it if they werent descendent from a company that willfully ignored atrocious customer satisfaction relative to competition  facebook was never truly liked by their consumers but it was a free product many people found essential with no reasonable competition  that same company now asking people to invest hundreds of dollars in a cuttingedge vr system is a nearimpossible sell,0.0875,0.515625,neutral,neutral,0.553027868
1177,and isnt it great to know that no matter how much bad publicity whistleblowers leaks etc the company experiences the average fool is still going to avidly use their products and only aid them in harvesting more and more of your data,0.171428571,0.688095238,neutral,positive,0.852848828
1178,i really hope facebook fails in this endeavor and people turn to more privacy focused devices and that actually privacy focused devices are made like linux phones,0.05,0.275,neutral,negative,0.942438662
1179,i dont think theres really any saving facebook because younger users arent going to want to use the same social media platform as their parents and grandparents none of my nieces and nephews use facebook and i completely understand the minute they subscribed all of my aunts and uncles would try to friend them,0.066666667,0.158333333,neutral,neutral,0.60475719
1180,to be honest i stopped using my oculus the moment zuck bought the company i think it makes sense to set yourself up as a market leader in future tech but i dont think that market share alone is going to pull back consumers who are avoiding facebookmeta,0.2,0.341666667,positive,negative,0.866826892
1181,i quit personal social media 2 years ago and couldnt be happier im weaning myself from yt due to getting constantly blasted by ads especially for tiktok which i havent ever used and dont plan to linkedin is the only social media site i use,-0.094047619,0.529761905,negative,negative,0.945956826
1182,i think facebook needs first to get a new ceo give up control of the news wall give users control in what their information is used for and regain users trust before even trying to create platforms nobody will trust in,0.193181818,0.393939394,neutral,neutral,0.650216162
1183,after just watching a few minutes of these old interviews im wondering why anyone trusted this guy to protect their data and personal information he always intended to sell you off to the highest bidder,-0.033333333,0.2,negative,negative,0.803925037
1184,the pivot to vr is a mistake even for the minority that want vr entertainment they want it on a game system where they can be relatively anonymous,-0.2,0.2,negative,negative,0.95236814
1185,the silence was deafeningboth when he joked about privacy and when the host asked girls to cheer for mark to take his sweatshirt off  tugs at collar like rodney dangerfield,0,0,neutral,negative,0.862795353
1186,i seriously doubt facebooks ability to pull off turning oculus into the next iphone and horizon into the next windows for a whole host of reasons they at best in my vision could compete with other vr platforms as a games store but the biggest issue is that vr does not provide any added convenience that the iphone doesnt already to do vr you need dedicated space the equipment supplementary technology privacy people dont want to use vr where people can see them and security people dont want to get messed with while in vr all an iphone needs is the phone occasional charging and either internet or cellular connection many steps in phone technology have been to improve ease of use like waterproofing being able to unlock your phone hands free etc all of this on top of the fact that facebook despite the rebrand just isnt hip theyre corporate and cold and their name taints anything they touch their data selling practice is relatively well known and their aesthetic makes them look like theyve never left their polished offices in san francisco for a day of their lives,0.136111111,0.352777778,neutral,neutral,0.660859704
1187,its really amazing that facebook is planning to get dominance on the nextlevel item metaverse i didnt even think about it before this analysis is quite persuasive and   i can understand well about this situation well now this is time for apple and google but someday facebook or other companies could take away that kind of status maybe its fun to imagine it,0.34375,0.59375,positive,positive,0.96861434
1188,fun fact i use social media less the more i feel like i get personalized content,0.166666667,0.208333333,neutral,neutral,0.588932455
1189,this does help explain why i thought it was rather odd facebook didnt bother trying to make horizon worlds work on non oculus headsets since that wouldve given them a wider potential userbase right now anyone currently more into the steamvr camp,0.154761905,0.571428571,neutral,neutral,0.614197254
1190,i actually was interested in getting into vr stuff but avoided oculus stuff very specifically when they added the requirement to login with a facebook around and i ended up pickin up a used dell windows mixed reality headset instead at a very good price very happy with it,0.393333333,0.488333333,positive,neutral,0.504312217
1191,great video again,0.8,0.75,positive,positive,0.928080618
1192,it is definitely an interesting play theyre going for seeing the popularity of mmos and vr chat it may work but im not sure how people would like the ad filled dystopia versions of those ,0.216666667,0.762962963,positive,positive,0.973644555
1193,maybe i just dont see what zuck sees i just dont see a lot of people wanting to engage in a vr world just to shop or watch videos,0,0,neutral,negative,0.943061531
1194,facebook expectations anticipate what the user wants to buy before he even knows it exists,0.2,0.1,positive,negative,0.852626204
1195,facebook reality recommends something you already bought and only need one of on repeat,0,1,neutral,negative,0.724410594
1196,the problem is that publicly traded companies must continue increasing their revenue and profit to be considered healthy as much as they might like to do what they do best and stay relevant within the social space they cant they are beholden,0.355555556,0.338888889,positive,negative,0.750327349
1197,i do agree that its a company strategy bold one at that theyre bankrolling the vr sector to eventually reap rewards fb just doesnt seem to have a killer app or even a good use case for their rather expensive technology theyre selling oculus for loss probably and the device itself is fairly affordable but youd need pretty beefy machine to properly use it and the users seem to be going more casual and mobile than ever before,0.187037037,0.692592593,neutral,negative,0.837583005
1198,i purposefully remove any ad  categories that facebook thinks im interested in and select hide all ads as often as possible honestly i dont care what it is i probably dont want to buy it and i certainly dont want it encroaching on my time and space i want to see posts from my friends not dumb ads i dont give a crap about targeted ads i dont want them to begin with im actually way less likely to buy nearly any product ive seen on an ad just because of how much it annoys me ,0.053192641,0.548917749,neutral,negative,0.963787496
1199,i think one thing that is missed is that even tho video photo and digital content is virtual the experience captured is real life not sure how comfortable or inclined people will be to share virtual spaces with their friends if facebook can find a way for people to easily capture real life spaces into vrar perhaps it would be more palatable as a social media product,0.189583333,0.461111111,neutral,neutral,0.558877051
1200,im so sick of facebooks community standards they keep banning you for little things thats not that serious,-0.411706349,0.674603175,negative,negative,0.94229269
1201,i stopped using facebook in 2014 because there was no point to it for the older generation it made sense as a way to connect to people you couldnt otherwise but for me being in high school i already knew those people and had their phone numbers or snapchat discord or whatever app other than that i didnt use facebook for anything like i dont care about what people post which goes for instagram theres no reason to care about posts on instagram from my perspective if someone has something to say or show they will text it to me the only social media ive used since 2014 is snapchat specifically to message people ,0.047,0.463,neutral,negative,0.913289487
1202,0042 the question is do you feel like youre violating peoples privacy,0,0,neutral,negative,0.901223481
1203,his answer was i started this company with my friends and other companies wanted to buy our company but we wanted to help connect people,-0.125,0.375,negative,positive,0.829762876
1204,the guy identifies this and goes back to the original question about privacy but the woman interrupts and says thats okay do you want to take off the hoodie,0.291666667,0.416666667,positive,negative,0.85816437
1205,i remember when several years ago before ios had perphoto privacy settings fb had collected a bunch of photos from my camera reel and decided to create an album out of them this was done without any voluntary action on my part while the app was in the background it was super creepy,-0.016666667,0.441666667,negative,negative,0.901061833
1206,facebook honestly from the ceo perspective shouldve never made their ad system so good they shouldve left a little bit of wiggle room so that if something happened they could sort of move to match it for advertisers,0.278125,0.5,positive,negative,0.841643214
1207,still watching the video but the seconhand embarrassment i felt at that woman for the implication that women want to see mark zuckerberg shirtless is viceral  i absolutely love silence in the crowd when she said that,0.5,0.6,positive,positive,0.825227559
1208,edit great video ive seen your newer ones and youve come a long way with your confidence in narrating your videos  love these longform informative types of videos theyre really great for when i have downtime at work and am not taking calls,0.5125,0.625,positive,positive,0.980151474
1209,the fact that this video and all the news articles talking about facebook are titled facebook and not meta means theyve already lost,0,0,neutral,negative,0.885117412
1210,excellent video you really understand the way facebook operates the context in which it operates and really made the case for zucks obsession with the meta verse,0.466666667,0.466666667,positive,positive,0.980814219
1211,as someone who works in the ad industry i think the issue with this thesis is that there is any incentive in the adcorporate world to admit that your facebook ad spend isnt producing results in this way fb has an edge in that they can provide worse ad sales outcomes and be protected from any results,-0.4,0.6,negative,negative,0.936442316
1212,its all about having control over peoples virtual identity where digital assets are getting attached to this is why they working on systems that people can use their one avatar in multiple apps those digital assets might not be restricted solely to vr objects it may comprise all kind of media and software they will provide a marketplace where they can earn some revenue share on purchases if they choose to implement their own currency they can also make money on the exchange and work with the money people dont cash out i think that meta is moving away from being depending on sale of advertisements they seem to prepare for a future with stricter privacy laws also still the metaverse is a gamble,0.2,0.3375,positive,negative,0.840910494
